{
  "schema_version": "isomer-kaoju-artifact-semantics.v1",
  "extension_id": "kaoju",
  "authority": {
    "list_command": "isomer-cli --print-json ext kaoju bindings list",
    "describe_command": "isomer-cli --print-json ext kaoju bindings describe KAOJU:WHAT"
  },
  "artifacts": [
    {
      "semantic_id": "KAOJU:MINDSET-RECORD",
      "category": "Run Reflection",
      "meaning": "Run-scoped materialized answers to one selected question set from an immutable snapshot of a topic Mindset Source and its pinned survey context.",
      "minimum_content": [
        "Source label, relative path, key, schema version, digest, selected question-set identity, triggering condition, selection kind and rationale, materialized questions and notes, Run and Survey Contract refs, answer states, evidence refs, collector posture, supplemental questions, Source-update disposition, and unresolved state. Historical Records may omit the additive Source-version and question-set-selection fields."
      ],
      "producer": "isomer-ext-kaoju-entrypoint",
      "consumers": [
        "isomer-kaoju-examine",
        "isomer-kaoju-audit"
      ],
      "update_intent": "Revise the Run-scoped current record with optimistic concurrency while preserving its immutable Source snapshot and every prior revision."
    },
    {
      "semantic_id": "KAOJU:WORKSPACE-READINESS",
      "category": "Workspace and Control",
      "meaning": "resolved Topic Workspace readiness, limits, blockers, and next allowed stage.",
      "minimum_content": [
        "resolved Topic Workspace readiness, limits, blockers, and next allowed stage."
      ],
      "producer": "isomer-kaoju-workspace-mgr",
      "consumers": [
        "isomer-ext-kaoju-entrypoint"
      ],
      "update_intent": "Revise the current scoped record when accepted state changes."
    },
    {
      "semantic_id": "KAOJU:BINDING-INDEX",
      "category": "Workspace and Control",
      "meaning": "validation result for the selected semantic contracts and supporting profiles.",
      "minimum_content": [
        "validation result for the selected semantic contracts and supporting profiles."
      ],
      "producer": "isomer-kaoju-workspace-mgr",
      "consumers": [
        "isomer-ext-kaoju-entrypoint"
      ],
      "update_intent": "Revise the current scoped record when accepted state changes."
    },
    {
      "semantic_id": "KAOJU:SURVEY-CONTRACT",
      "category": "Workspace and Control",
      "meaning": "accepted question, boundary, source classes, cutoff, depth, resources, Gates, and stop conditions.",
      "minimum_content": [
        "accepted question, boundary, source classes, cutoff, depth, resources, Gates, and stop conditions."
      ],
      "producer": "isomer-kaoju-frame",
      "consumers": [
        "isomer-kaoju-discover",
        "isomer-kaoju-audit",
        "isomer-kaoju-synthesize"
      ],
      "update_intent": "Revise the current scoped record when accepted state changes."
    },
    {
      "semantic_id": "KAOJU:DIRECTION-SET",
      "category": "Workspace and Control",
      "meaning": "actor-reviewed direction proposals, choices, custom entries, feasibility notes, and history.",
      "minimum_content": [
        "actor-reviewed direction proposals, choices, custom entries, feasibility notes, and history."
      ],
      "producer": "isomer-kaoju-frame",
      "consumers": [
        "isomer-kaoju-discover",
        "isomer-ext-kaoju-entrypoint"
      ],
      "update_intent": "Revise the current scoped record when accepted state changes."
    },
    {
      "semantic_id": "KAOJU:COMPARISON-INTENT",
      "category": "Workspace and Control",
      "meaning": "actor-reviewed plan for a source-grounded or empirical comparison.",
      "minimum_content": [
        "actor-reviewed plan for a source-grounded or empirical comparison."
      ],
      "producer": "isomer-kaoju-frame",
      "consumers": [
        "isomer-kaoju-compare"
      ],
      "update_intent": "Revise the current scoped record when accepted state changes."
    },
    {
      "semantic_id": "KAOJU:PROCEED-DECISION",
      "category": "Workspace and Control",
      "meaning": "explicit clarify, proceed, pause, reject, or stop decision.",
      "minimum_content": [
        "explicit clarify, proceed, pause, reject, or stop decision."
      ],
      "producer": "isomer-ext-kaoju-entrypoint",
      "consumers": [
        "isomer-ext-kaoju-entrypoint"
      ],
      "update_intent": "Append a new record for each accepted event or change."
    },
    {
      "semantic_id": "KAOJU:DISCOVERY-LEDGER",
      "category": "Discovery and Acquisition",
      "meaning": "bounded searches, routes, dates, identities, version families, dispositions, gaps, and frontier.",
      "minimum_content": [
        "bounded searches, routes, dates, identities, version families, dispositions, gaps, and frontier."
      ],
      "producer": "isomer-kaoju-discover",
      "consumers": [
        "isomer-kaoju-audit",
        "isomer-ext-kaoju-entrypoint"
      ],
      "update_intent": "Revise the current scoped record when accepted state changes."
    },
    {
      "semantic_id": "KAOJU:READING-LIST",
      "category": "Discovery and Acquisition",
      "meaning": "one direction-scoped priority and secondary target set with target derivation, achieved counts, coverage, and shortage notes.",
      "minimum_content": [
        "one direction-scoped priority and secondary target set with target derivation, achieved counts, coverage, and shortage notes."
      ],
      "producer": "isomer-kaoju-discover",
      "consumers": [
        "isomer-kaoju-acquire",
        "isomer-kaoju-examine",
        "isomer-kaoju-audit"
      ],
      "update_intent": "Revise the current scoped record when accepted state changes."
    },
    {
      "semantic_id": "KAOJU:RELATED-WORK-CATALOG",
      "category": "Discovery and Acquisition",
      "meaning": "current identity-resolved catalog of relevant primary works and supporting materials.",
      "minimum_content": [
        "current identity-resolved catalog of relevant primary works and supporting materials."
      ],
      "producer": "isomer-kaoju-discover",
      "consumers": [
        "isomer-kaoju-examine",
        "isomer-kaoju-audit",
        "isomer-kaoju-synthesize",
        "isomer-kaoju-write"
      ],
      "update_intent": "Revise the current scoped record when accepted state changes."
    },
    {
      "semantic_id": "KAOJU:RELATED-WORK-DELTA",
      "category": "Discovery and Acquisition",
      "meaning": "auditable additions, changes, exclusions, and evidence against a catalog revision.",
      "minimum_content": [
        "auditable additions, changes, exclusions, and evidence against a catalog revision."
      ],
      "producer": "isomer-kaoju-discover",
      "consumers": [
        "isomer-kaoju-discover"
      ],
      "update_intent": "Append a new record for each accepted event or change."
    },
    {
      "semantic_id": "KAOJU:CURATED-INTAKE-DELTA",
      "category": "Discovery and Acquisition",
      "meaning": "dispositions and survey effects of actor-nominated materials.",
      "minimum_content": [
        "dispositions and survey effects of actor-nominated materials."
      ],
      "producer": "isomer-kaoju-discover",
      "consumers": [
        "isomer-kaoju-acquire"
      ],
      "update_intent": "Append a new record for each accepted event or change."
    },
    {
      "semantic_id": "KAOJU:ARTIFACT-LIBRARY",
      "category": "Discovery and Acquisition",
      "meaning": "current state of acquired papers, reports, repositories, datasets, models, and related materials.",
      "minimum_content": [
        "current state of acquired papers, reports, repositories, datasets, models, and related materials."
      ],
      "producer": "isomer-kaoju-acquire",
      "consumers": [
        "isomer-kaoju-examine",
        "isomer-kaoju-trial"
      ],
      "update_intent": "Revise the current scoped record when accepted state changes."
    },
    {
      "semantic_id": "KAOJU:ASSOCIATED-SOURCE-CODE",
      "category": "Discovery and Acquisition",
      "meaning": "verified relationship between a work identity and an immutable repository identity.",
      "minimum_content": [
        "verified relationship between a work identity and an immutable repository identity."
      ],
      "producer": "isomer-kaoju-acquire",
      "consumers": [
        "isomer-kaoju-examine",
        "isomer-kaoju-trial"
      ],
      "update_intent": "Revise the current scoped record when accepted state changes."
    },
    {
      "semantic_id": "KAOJU:MATERIAL-ACQUISITION-MANIFEST",
      "category": "Discovery and Acquisition",
      "meaning": "observed identities, availability, checksums or commits, access posture, and provenance.",
      "minimum_content": [
        "observed identities, availability, checksums or commits, access posture, and provenance."
      ],
      "producer": "isomer-kaoju-acquire",
      "consumers": [
        "isomer-kaoju-examine"
      ],
      "update_intent": "Append a new record for each accepted event or change."
    },
    {
      "semantic_id": "KAOJU:TOPIC-DATASET-MANIFEST",
      "category": "Discovery and Acquisition",
      "meaning": "actor-authorized inventory of external and managed datasets available to the topic.",
      "minimum_content": [
        "actor-authorized inventory of external and managed datasets available to the topic."
      ],
      "producer": "isomer-kaoju-workspace-mgr",
      "consumers": [
        "isomer-kaoju-trial",
        "isomer-kaoju-compare"
      ],
      "update_intent": "Revise the current scoped record when accepted state changes."
    },
    {
      "semantic_id": "KAOJU:GENERATED-DATASET",
      "category": "Environment and Trials",
      "meaning": "reproducible generated input definition, outputs, checks, purpose, and limitations.",
      "minimum_content": [